{
  "$schema": "https://json-schema.org/draft/2020-12/schema",
  "$id": "https://agentic-turtles/schemas/plan.schema.json",
  "title": "Agentic Turtles Plan Document",
  "description": "Structured plan proposed by an agent and frozen by operator approval. System of record for steps, priorities, evidence tags, boundary cases, and verification targets.",
  "type": "object",
  "additionalProperties": false,
  "required": ["feature", "version", "run_id", "andon_issue", "steps", "verification_targets", "boundary_cases"],
  "properties": {
    "feature": { "type": "string", "pattern": "^[0-9]{3}-[a-z0-9-]+$" },
    "version": { "type": "integer", "minimum": 1 },
    "supersedes": { "type": ["integer", "null"], "minimum": 1 },
    "run_id": { "type": "string", "minLength": 1 },
    "andon_issue": { "type": "integer", "minimum": 1 },
    "steps": {
      "type": "array",
      "minItems": 1,
      "items": { "$ref": "#/$defs/PlanStep" }
    },
    "verification_targets": {
      "type": "array",
      "items": { "$ref": "#/$defs/VerificationTarget" }
    },
    "boundary_cases": {
      "type": "array",
      "items": { "$ref": "#/$defs/BoundaryCase" }
    },
    "state_transitions": {
      "type": "array",
      "items": { "$ref": "#/$defs/StateTransition" },
      "description": "OPTIONAL and must stay so: every plan frozen before GHI #289 carries none, and absent means the plan has no state transitions, never that they are unjudged (FR-042)"
    }
  },
  "$defs": {
    "PlanStep": {
      "type": "object",
      "additionalProperties": false,
      "required": ["id", "title", "intent", "acceptance", "priority", "evidence_tag", "high_stakes", "depends_on"],
      "properties": {
        "id": { "type": "string", "pattern": "^step-[a-z0-9-]+$" },
        "title": { "type": "string", "minLength": 1 },
        "intent": { "type": "string", "minLength": 1 },
        "acceptance": {
          "type": "string",
          "minLength": 1,
          "description": "Empirically testable outcome metric (FR-017)"
        },
        "priority": { "enum": ["MUST", "SHOULD", "COULD"] },
        "evidence_tag": { "enum": ["verified", "assumption"] },
        "stand_in": {
          "type": ["string", "null"],
          "description": "Most representative named stand-in source; required when evidence_tag=assumption (FR-020)"
        },
        "high_stakes": { "type": "boolean" },
        "authority": {
          "enum": ["customer", "clinical", "legal", "security-regulatory", null],
          "description": "Required when high_stakes=true (FR-023). Extensible in future schema versions; security-regulatory added 2026-09-04 (operator ask) for information-security and regulatory-compliance sign-off."
        },
        "depends_on": {
          "type": "array",
          "items": { "type": "string", "pattern": "^step-[a-z0-9-]+$" },
          "description": "Dependency edges used to propagate wrong-assumption flags (FR-022)"
        },
        "scope": {
          "type": "array",
          "items": { "type": "string", "minLength": 1 },
          "description": "OPTIONAL (T223, FR-061). The path globs this step's deliverable may touch, relative to the repo root — `docs/**`, `src/app.py`, `site/*.html`. Deliverable-gate D2 validates the patch against exactly this set and names any straying path. OPTIONAL because a required field would break every plan frozen before 2026-08-24; D2 reports not-applicable (naming the absent field) for a step without one rather than passing silently, since a scope-less plan cannot make the containment promise. SUBJECT BOUNDARY (FR-068): scope is an INCLUSION allowlist and cannot widen what a build may touch — plan-gate G16 refuses a plan whose scope intersects the reserved path set, and deliverable-gate D5 refuses such a patch regardless of what this field says."
        },
        "reads": {
          "type": "array",
          "items": { "type": "string", "minLength": 1 },
          "description": "OPTIONAL (GHI #274, FR-071). The path globs this step must READ in order to produce its deliverable \u2014 the read side of `scope`, same glob grammar. NOT an allowlist, and nothing is refused for violating it: a build step must read the repository it is editing, so \"may read only what it declared\" would make every step in every plan illegal. Plan-gate G20 reports, as an ADVISORY finding, any declared read that none of its three legitimate providers will supply \u2014 it exists at the approval ref, a step this one comes after writes it, or a root `<name>.lock` fetches it into `vendor/<name>`. OPTIONAL because a required field would break every plan frozen before 2026-09-17."
        },
        "tracking_issue": {
          "type": ["integer", "null"],
          "minimum": 1,
          "description": "The WORK ITEM issue this step delivers — the one issue that represents this step's work, and the single meaning of this field (clarified 2026-08-17, GHI #101). It is both the FR-025 mirror for linkability and the FR-017 build binding: preflight B3 refuses a build whose --chunk is not the tracking_issue of a step in the frozen plan, confirm-record applies confirmed:<authority> to it, and the portfolio attributes conflict:open through it. At most one step per issue — B3 asks whether ANY step tracks the named chunk, so two would make 'which step is this build for?' unanswerable. Inherited by plan-propose / plan-revise from the prior version and written by the operator under Work items on the review page at Commit for approval (ADR-0002); null when no work item covers the step."
        }
      },
      "allOf": [
        {
          "if": { "properties": { "evidence_tag": { "const": "assumption" } } },
          "then": { "required": ["stand_in"], "properties": { "stand_in": { "type": "string", "minLength": 1 } } }
        },
        {
          "if": { "properties": { "high_stakes": { "const": true } } },
          "then": { "properties": { "authority": { "enum": ["customer", "clinical", "legal", "security-regulatory"] } }, "required": ["authority"] }
        }
      ]
    },
    "VerificationTarget": {
      "type": "object",
      "additionalProperties": false,
      "required": ["id", "kind", "check", "maps_to"],
      "properties": {
        "id": { "type": "string", "pattern": "^vt-[a-z0-9-]+$" },
        "kind": { "enum": ["expected-output", "exact-copy", "boundary-behavior"] },
        "check": {
          "type": "string",
          "minLength": 1,
          "description": "A single pass/fail assertion (FR-011)"
        },
        "run": {
          "type": "string",
          "minLength": 1,
          "description": "OPTIONAL (T223, FR-063). The EXECUTABLE form of `check`: a single shell command, run from the repo root of the MERGED deliverable commit, whose exit status is the verdict (0 = success, non-zero = failure). Present, the verify run is deterministic — no model interprets anything, and the operator approved the exact command that will judge their work (constitution: Deterministic-First Execution). Absent, `check` stays prose and a conformant executor in verify mode interprets it. `check` remains REQUIRED either way: it is what the operator reviews, and a command with no stated intent is not a commitment anyone judged."
        },
        "maps_to": {
          "type": "array",
          "minItems": 1,
          "items": { "type": "string", "pattern": "^step-[a-z0-9-]+$" }
        }
      }
    },
    "BoundaryCase": {
      "type": "object",
      "additionalProperties": false,
      "required": ["id", "description"],
      "properties": {
        "id": { "type": "string", "pattern": "^bc-[a-z0-9-]+$" },
        "description": { "type": "string", "minLength": 1 },
        "step_id": { "type": "string", "pattern": "^step-[a-z0-9-]+$" }
      }
    },
    "StateTransition": {
      "type": "object",
      "additionalProperties": false,
      "required": ["id", "description"],
      "properties": {
        "id": { "type": "string", "pattern": "^st-[a-z0-9-]+$" },
        "description": { "type": "string", "minLength": 1 },
        "step_id": { "type": "string", "pattern": "^step-[a-z0-9-]+$" }
      },
      "description": "The other half of FR-002 (GHI #289): a state transition the operator judges, same shape as a boundary case because the product does the same things to both"
    }
  }
}
